{
  "actions": {
    "idle": {
      "clips": {
        "sd": {
          "bk": [
            {
              "file": "guardian_sd_idle_bk0.svg",
              "prompt_hash": "pending",
              "seed": 2006
            }
          ],
          "fr": [
            {
              "file": "guardian_sd_idle_fr0.svg",
              "prompt_hash": "pending",
              "seed": 2006
            }
          ],
          "lf": [
            {
              "file": "guardian_sd_idle_lf0.svg",
              "prompt_hash": "pending",
              "seed": 2006
            }
          ],
          "rt": [
            {
              "file": "guardian_sd_idle_rt0.svg",
              "prompt_hash": "pending",
              "seed": 2006
            }
          ]
        },
        "td": {
          "bk": [
            {
              "file": "guardian_td_idle_bk0.svg",
              "prompt_hash": "pending",
              "seed": 2006
            }
          ],
          "fr": [
            {
              "file": "guardian_td_idle_fr0.svg",
              "prompt_hash": "pending",
              "seed": 2006
            }
          ],
          "lf": [
            {
              "file": "guardian_td_idle_lf0.svg",
              "prompt_hash": "pending",
              "seed": 2006
            }
          ],
          "rt": [
            {
              "file": "guardian_td_idle_rt0.svg",
              "prompt_hash": "pending",
              "seed": 2006
            }
          ]
        }
      },
      "fps": 2,
      "frames": 1,
      "loop": true
    },
    "walk": {
      "clips": {
        "sd": {
          "bk": [
            {
              "file": "guardian_sd_walk_bk1.svg",
              "prompt_hash": "pending",
              "seed": 2006
            },
            {
              "file": "guardian_sd_walk_bk2.svg",
              "prompt_hash": "pending",
              "seed": 2006
            }
          ],
          "fr": [
            {
              "file": "guardian_sd_walk_fr1.svg",
              "prompt_hash": "pending",
              "seed": 2006
            },
            {
              "file": "guardian_sd_walk_fr2.svg",
              "prompt_hash": "pending",
              "seed": 2006
            }
          ],
          "lf": [
            {
              "file": "guardian_sd_walk_lf1.svg",
              "prompt_hash": "pending",
              "seed": 2006
            },
            {
              "file": "guardian_sd_walk_lf2.svg",
              "prompt_hash": "pending",
              "seed": 2006
            }
          ],
          "rt": [
            {
              "file": "guardian_sd_walk_rt1.svg",
              "prompt_hash": "pending",
              "seed": 2006
            },
            {
              "file": "guardian_sd_walk_rt2.svg",
              "prompt_hash": "pending",
              "seed": 2006
            }
          ]
        },
        "td": {
          "bk": [
            {
              "file": "guardian_td_walk_bk1.svg",
              "prompt_hash": "pending",
              "seed": 2006
            },
            {
              "file": "guardian_td_walk_bk2.svg",
              "prompt_hash": "pending",
              "seed": 2006
            }
          ],
          "fr": [
            {
              "file": "guardian_td_walk_fr1.svg",
              "prompt_hash": "pending",
              "seed": 2006
            },
            {
              "file": "guardian_td_walk_fr2.svg",
              "prompt_hash": "pending",
              "seed": 2006
            }
          ],
          "lf": [
            {
              "file": "guardian_td_walk_lf1.svg",
              "prompt_hash": "pending",
              "seed": 2006
            },
            {
              "file": "guardian_td_walk_lf2.svg",
              "prompt_hash": "pending",
              "seed": 2006
            }
          ],
          "rt": [
            {
              "file": "guardian_td_walk_rt1.svg",
              "prompt_hash": "pending",
              "seed": 2006
            },
            {
              "file": "guardian_td_walk_rt2.svg",
              "prompt_hash": "pending",
              "seed": 2006
            }
          ]
        }
      },
      "fps": 6,
      "frames": 2,
      "loop": true
    },
    "attack": {
      "clips": {
        "sd": {
          "bk": [
            {
              "file": "guardian_sd_attack_bk1.svg",
              "prompt_hash": "pending",
              "seed": 2006
            },
            {
              "file": "guardian_sd_attack_bk2.svg",
              "prompt_hash": "pending",
              "seed": 2006
            }
          ],
          "fr": [
            {
              "file": "guardian_sd_attack_fr1.svg",
              "prompt_hash": "pending",
              "seed": 2006
            },
            {
              "file": "guardian_sd_attack_fr2.svg",
              "prompt_hash": "pending",
              "seed": 2006
            }
          ],
          "lf": [
            {
              "file": "guardian_sd_attack_lf1.svg",
              "prompt_hash": "pending",
              "seed": 2006
            },
            {
              "file": "guardian_sd_attack_lf2.svg",
              "prompt_hash": "pending",
              "seed": 2006
            }
          ],
          "rt": [
            {
              "file": "guardian_sd_attack_rt1.svg",
              "prompt_hash": "pending",
              "seed": 2006
            },
            {
              "file": "guardian_sd_attack_rt2.svg",
              "prompt_hash": "pending",
              "seed": 2006
            }
          ]
        },
        "td": {
          "bk": [
            {
              "file": "guardian_td_attack_bk1.svg",
              "prompt_hash": "pending",
              "seed": 2006
            },
            {
              "file": "guardian_td_attack_bk2.svg",
              "prompt_hash": "pending",
              "seed": 2006
            }
          ],
          "fr": [
            {
              "file": "guardian_td_attack_fr1.svg",
              "prompt_hash": "pending",
              "seed": 2006
            },
            {
              "file": "guardian_td_attack_fr2.svg",
              "prompt_hash": "pending",
              "seed": 2006
            }
          ],
          "lf": [
            {
              "file": "guardian_td_attack_lf1.svg",
              "prompt_hash": "pending",
              "seed": 2006
            },
            {
              "file": "guardian_td_attack_lf2.svg",
              "prompt_hash": "pending",
              "seed": 2006
            }
          ],
          "rt": [
            {
              "file": "guardian_td_attack_rt1.svg",
              "prompt_hash": "pending",
              "seed": 2006
            },
            {
              "file": "guardian_td_attack_rt2.svg",
              "prompt_hash": "pending",
              "seed": 2006
            }
          ]
        }
      },
      "fps": 8,
      "frames": 2,
      "loop": false,
      "next": "idle"
    }
  },
  "asset": "guardian",
  "id": "guardian_001",
  "kind": "character",
  "masters": {
    "sd": "master_side.svg",
    "td": "master_td.svg"
  },
  "palette": "palette_character@v1",
  "perspectives": [
    "td",
    "sd"
  ],
  "preview": {
    "action": "idle",
    "dir": "fr",
    "perspective": "td"
  },
  "seed": 2006,
  "size": 64,
  "use": "2d-rpg",
  "views": [
    "fr",
    "bk",
    "lf",
    "rt"
  ]
}
